{
  "schema_version": "ToolCallEnvelope_v1",
  "envelope_id": "bts_gate_20260502T002301Z_82792a9e",
  "stage_id": "BTS_V4_GATE_WRAPPED_RUNTIME",
  "action_type": "filesystem",
  "tool_name": "append_bts_log",
  "command_summary": "",
  "intent": "Append BTS hash-chain log entry",
  "risk_tier": "low",
  "requested_at_utc": "2026-05-02T00:23:01.882298Z",
  "requires_see": false,
  "see_evidence_refs": [],
  "limits": {
    "timeout_seconds": 10,
    "max_files": 1,
    "max_bytes": 1281,
    "max_steps": 1
  },
  "artifacts": {
    "read_paths": [],
    "write_paths": [
      "/mnt/data/Metablooms_OS/bts/bts_log.ndjson"
    ],
    "receipt_path": "/mnt/data/Metablooms_OS/runtime/governance/receipts/per_action_tool_interception_v1/bts_gate_20260502T002301Z_82792a9e.decision.json"
  },
  "metadata": {
    "caller": "BTS_v4_gate_wrapped",
    "ledger_surface": "BTS_V4_CANONICAL_RECEIPT_ENGINE"
  }
}